{
  "$schema": "https://json-schema.org/draft/2020-12/schema",
  "$id": "https://vsn.internal/schemas/vsn-model-manifest.schema.json",
  "title": "VSNModelManifest",
  "description": "Metadata-only registration contract for VSN-owned model artifacts. This contract records provenance and verification state but does not authorize provider registration, routing activation, training, deployment, or paid compute.",
  "type": "object",
  "additionalProperties": false,
  "required": [
    "schema_version",
    "model_id",
    "model_version",
    "lifecycle_state",
    "capabilities",
    "artifact",
    "provenance",
    "verification"
  ],
  "properties": {
    "schema_version": {"const": 1},
    "model_id": {
      "type": "string",
      "pattern": "^vsn-[a-z0-9][a-z0-9._-]{0,62}$"
    },
    "model_version": {
      "type": "string",
      "pattern": "^(0|[1-9][0-9]*)\\.(0|[1-9][0-9]*)\\.(0|[1-9][0-9]*)(?:-[0-9A-Za-z.-]{1,32})?$"
    },
    "lifecycle_state": {
      "enum": ["registered", "verification_required", "verified", "deprecated"]
    },
    "capabilities": {
      "type": "array",
      "minItems": 1,
      "maxItems": 20,
      "uniqueItems": true,
      "items": {
        "enum": [
          "audio.noise_cancel",
          "audio.background_voice_cancel",
          "audio.echo_reduce",
          "audio.vad",
          "voice.accent_convert",
          "voice.identity_preserve",
          "voice.deepfake_detect",
          "voice.speaker_verify",
          "speech.translate_realtime",
          "speech.transcribe_stream",
          "speech.transcribe_finalize",
          "speech.synthesize",
          "meeting.capture",
          "meeting.transcript",
          "meeting.intelligence",
          "conversation.score",
          "knowledge.search",
          "assistant.realtime",
          "agent.action",
          "telephony.media"
        ]
      }
    },
    "artifact": {
      "type": "object",
      "additionalProperties": false,
      "required": ["artifact_id", "format", "sha256"],
      "properties": {
        "artifact_id": {
          "type": "string",
          "pattern": "^MODELART-[A-Z0-9][A-Z0-9._-]{0,63}$"
        },
        "format": {"enum": ["onnx"]},
        "sha256": {
          "type": "string",
          "pattern": "^[a-f0-9]{64}$",
          "not": {"const": "0000000000000000000000000000000000000000000000000000000000000000"}
        }
      }
    },
    "provenance": {
      "type": "object",
      "additionalProperties": false,
      "required": [
        "dataset_registry_refs",
        "rights_review_status",
        "deletion_lineage_status"
      ],
      "properties": {
        "dataset_registry_refs": {
          "type": "array",
          "minItems": 1,
          "maxItems": 64,
          "uniqueItems": true,
          "items": {
            "type": "string",
            "pattern": "^DATASET-[A-Z0-9][A-Z0-9._-]{0,63}$"
          }
        },
        "rights_review_status": {
          "enum": ["verification_required", "verified"]
        },
        "deletion_lineage_status": {
          "enum": ["verification_required", "verified"]
        }
      }
    },
    "verification": {
      "type": "object",
      "additionalProperties": false,
      "required": [
        "artifact_integrity",
        "benchmark",
        "security_review",
        "rollback"
      ],
      "properties": {
        "artifact_integrity": {"enum": ["verification_required", "verified"]},
        "benchmark": {"enum": ["verification_required", "verified"]},
        "security_review": {"enum": ["verification_required", "verified"]},
        "rollback": {"enum": ["verification_required", "verified"]}
      }
    }
  },
  "allOf": [
    {
      "if": {
        "properties": {"lifecycle_state": {"const": "verified"}},
        "required": ["lifecycle_state"]
      },
      "then": {
        "properties": {
          "provenance": {
            "properties": {
              "rights_review_status": {"const": "verified"},
              "deletion_lineage_status": {"const": "verified"}
            }
          },
          "verification": {
            "properties": {
              "artifact_integrity": {"const": "verified"},
              "benchmark": {"const": "verified"},
              "security_review": {"const": "verified"},
              "rollback": {"const": "verified"}
            }
          }
        }
      }
    }
  ]
}
